ID,grade,teacher,time,T1,T2,T3,T4,S1,S2,S3,S4,S5,purpose,criteria,generality,evidence,audience1,audience2301167,5,1,2,2,,,,0,0,0,0,0,The purpose of my model is to inform and teach whoever about condensation. It is also to help me so I understand condensation. I would use my model to teach my peers about condensation or to study for a test.,"A good model shows the main scientific idea through labels, arrows, and explanations. It shows the ""how"" and ""why"" and doesn't leave the audience asking, ""ok, but why does that happen?"" Through all this it is understandable and neat and organized.",All the different ways that condensation happens. Because then if not that means you are ignoring the generality piece in GAME and it cannot be used to explain other phenomena.,Yes. It uses it because that is where I got my evidence to prove my theory's.,To help me to better understand and others to better understand,"I would tell them that if water seeps through the inside of a container than (like with the icepack) it would be blue, and all that water inside would be gone in minutes."301169,5,1,2,2,,,,0,0,0,0,0,The purpose of my model is to show condensation. My model would be for people who may not know what it is.,"Some things are labels, molecules, arrows, explanation, key, and a phenomena.",Yes  because it could help explaining different phenomena but would still involve condensation.,Yes because it is useful when you want to refer to condensation.,Any thing that my model is useful for that includes condensation.,When water evaporates it goes to the outside of the cup or object and is called condensation.301170,5,1,2,2,,,,0,0,0,0,0,I think the purpose of my model is to teach people about how condensation works. I would use my model to see in later years how much progress I have made.,"What makes a good model is labels, explanation, evidence, not to specific.",I think it should explain all the different ways condensation happens because condensation doesn't just happen on pop cans or ice packs it happens on anything that is cold with warm water vapor around it.,Yes it dose it has the molecules from the simulations and has proof from the experiments.,I think it for the people learning about condensation.,What I would do is show them my model and if that doesn't work I would get something cold without water in it and they would see how the water droplet appear on that surface.301118,5,1,2,2,,,,0,0,0,0,0,Why do cold surfaces have water on it. To explain how condensation or evaporation.,"Molecules, keys, arrows, prove, explanation, a big idea, phenomena, audience.",I think you should have any you want. So your audience doesn't think thats the only way condensation happens.,Yes it shows condensation on a window and thats one of the things we did.,To help them learn or help other people learn.,Well I would ask them do you see the water on the table and then ill explain it to them.301120,5,1,2,2,,,,2,0,0,0,0,The purpose of my model is to explain condensation. I might use my model to explain to somebody condensation if they didn't know what it was.,"A good model makes sense, has evidence, how? And why? Are explained, has data, and focuses on the scientific idea.",I think my model should mainly focus on a specific situation. Because then it doesnt' go off in a bunch of different directions and get confusing.,"Yes. In class they talked about how a Coke can with moisture on it, has to do with condensation, so I included something like it in my model (the Diet Pepsi can).",10-12 year olds.,Show them my model and explain it to them and try to convince them.301123,5,1,2,2,,,,0,0,0,0,0,"My model's purpose is to persuade people who look at my model to know that the molecules get colder when they come near a cold object, they slow down. I might use my model to help me learn how condensation forms.","The one thing a good model needs is MSU showing how and why, showing the condensation phenomenon. And evidence.",I think it should focus on one thing at a time. So it wouldn't get confusing with all the arrows and phenomenon also with the objects might be a whole another subject or now showing how and why.,"Yes it shows the way MSU works in generality, audience, mechanism, and evidence, all along with our investigations.",To show how condensation forms from molecules forming on a cold object.,"I might show them that the water comes from the air, not inside. I would show them my model. And they would see molecules cling to cold object and slowing down."301125,5,1,2,2,,,,0,0,0,0,0,The purpose of my model is condensation. I might use this model to show somebody how condensation works.,MSU makes a good model which stands for: G = generality - relating real life phenomenon. A = Audience - to show labels/to make it clear and understand. M = Mechanism - showing a how and why explanation. E = evidence - showing evidence on how it works.,I think it should focus on multiple phenomenon I think that because if you were to show somebody that you wouldn't want them to think thats the only way that condensation works.,Yes it uses this information because I put in temperature change when my teacher told me was needed.,Anyone who wants to learn about condensation.,"I might convince them to a stronger scientific idea by showing them what I've learned in the lesson, and maybe doing a experiment with them."301341,5,1,2,2,,,,0,0,0,0,0,My models purpose is to help understand condensation better. I might use my model for to understand because that is the purpose.,"by going through the MSU sheet and making sure that every sing little detail for condensation is included especially how and why, evidence, audience","Explain different kinds of condensation because if you use a cold pop can or ice pack, the person who is looking at my model will think that condensation only happens on a cold pop can or an ice pack.",A little bit because I left out the how and why piece and labels even if I had a key. But I used water vapor and other molecules. ,For anyone who doesn't understand condensation or is not clear about condensation.,I would do the ice pack experiment and who him and then when it is condensation I would tell the person that if it's seeping the ice pack condensation would turn blue because the ice pack is blue.301130,5,1,2,2,,,,0,0,0,0,0,The purpose of my model is to explain condensation and show MSU,I show a lot of evidence witch is a big part of MSU,I think it shows a number of ways because your model needs evidence too show it mainly witch my model does.,Yes I think that it does. Because it shows MSU and other stuff.,I think it is for showing and explaining condensation.,Because water can not seep through a closed cup so it has to come from somewhere else witch is the air.301131,5,1,2,2,,,,0,0,0,0,0,You would be able to use this model to explain how and why condensation happens in an understandable way. ,"What I think makes a good model is; making it neat and clear, to include things like arrows, labels, and keys, being able to explain of phenomena, showing the evidence on our model, having all of the extra drawings taken out.",,,,301132,5,1,2,2,,,,0,0,0,0,0,"My model could be used for answering the question ""How and why does water go on a cold object overtime?""","A good model includes MSU Generality, which means is it general to explain other phenomena, audience does the audience understand, mechanism how and why, and evidence does your show proof.",I think,,,301134,5,1,2,2,,,,0,0,2,0,0,To explain condensation.,IT needs the bi idea.,Yes because it is the same model but in a different way.,Yes because we did an experiment with a coke can.,People who don't know condensation.,When water vapor comes near a cold objet it slows down and turns back to a liquid.301136,5,1,2,2,,,,0,0,0,0,0,,,Yes your model should explain different phenomena because then if someone for example does not understand how when you put your hand on a cold glass and fog is left and you show them our model of a coke can they would not understand it and would be confused.,Yes by the mol. And the mol. Moving and clumping together.,For the MSU research group and myself its for myself so I can understand condensation better.,I show them my model and explain to them why it doesn't seep through and if they still don't understand then I'd do the solar still model with them and show them.301139,5,1,2,2,,,,0,0,0,0,0,For showing condensation to people who might not understand condensation.,"A key, molecules, water droplets, cold can, org., arrows and a explanation are all thing that make a good model you can.",Only the cold pop can and ice pack because they shouldn't see every thing in one model.,Yes because my teacher is the one who taught me about condensation in the first place.,I think my model is for smaller kids and adults.,I will show them my model and explain to them what really happens the molecules of the outside air comes in and since the pop can is so cold it is a big temperature change so it changes from a gas to a liquid because molecules are always moving so they hit against the can.301140,5,1,2,2,,,,0,0,0,0,0,To explain condensation all of the pitchers and writing has something to do with condensation.,A good model explains all the phenomena in a big idea it explains how and why things happen and labels clearly what its showing and provides evidence.,All the different ways so that people know that condensation is everywhere not just on cold cans or ice packs.,Yes three of the captions explain about the movement of molecules that is from the simulations the cold can idea we witnessed in class and the teacher said a lot about the slowing down and clumping. ,People that aren't extremely knowledgeable on this matter that want to know more about it.,If you put something cold out even if it's empty you will see condensation on it try it besides what's the point of a glass that leaks301141,5,1,2,2,,,,0,0,0,0,0,The purpose of my model is to show how condensation works. I would use my model to show someone condensation. ,"A good model shows generality, audience, mechanism and evidence.",I think my model should explain all the different ways. Because if it didn't your model wouldn't show all of condensation.,Yes yes it does because it has a explanation and things from the investigation. ,My model is for people who need a explanation on condensation.,I would show them my model and then try it out in real life.301176,5,2,2,,2,,,0,0,0,0,0,To show condensation,Good models aren't specific. Good models are clear to others. Good models include detail. Good models are supported.,It should explain all the different ways that condensation happens so its not so specific.,Yes it shows condensations. It shows gas particles turning into a liquid.,Everybody.,When a gas hits a cold object it gets all the energy sucked out of it and turns into a liquid.301178,5,2,2,,2,,,0,0,0,0,0,To show condensation.,Detail also a good model should stay on topic and show GAME.,I think that my model should explain all of the different ways condensation. Because condensation is gas turning into a liquid and every condensation model should show that.,Yes because it uses all of the information my class talked about.,No one.,By showing them a model of condensation and asking them to make a model of what they think is condensation.301364,5,2,2,,2,,,0,0,0,0,0,The purpose of my model is to show condensation. I might use my model to collect water.,It should show GAME.,It should show all the different ways it happens. So it can be easier to understand condensation.,It does. It uses it by  showing GAME in all models.,A scientist.,I would convince by telling the process of the process of condensation.301180,5,2,2,,2,,,0,0,0,0,0,To show what happens later and explain what happened.,What I said on number 2 above.,Yes so you can relate easily.,,,301181,5,2,2,,2,,,0,2,0,0,0,The purpose of my model was to explain condensation. I might use it to show someone how condensation works. ,"A good model is general enough for any phenomenon, clear for the age group intended, shows what is happening and is backed by evidence.",Not to specific. A good model is general.,Yes. I put everything from memory and then check my to make sure I hadn't left anything else.,I think it is for explaining condensation.,"By doing an experiment with coke cans instead of a, say, water bottle. If the liquid seeped through, it would be coke, not water."301182,5,2,2,,2,,,0,0,0,0,0,"To show condensation, to show other people how condensation works.",To be neat. To be showing how and why the model is about and is done.,I think the first one. Because there are a lot of different ways to show condensation.,It help me to find out that you can see condensation in only warm whether. ,To show condensation.,"I think that they now a little about condensation but, not a lot."301189,5,2,2,,2,,,0,0,0,0,0,The purpose of my model is to show condensation. The model is useful for trying to get the idea of condensation.,"Water vapor and labels, arrows, water droplets, make models clear to understand about condensation.",,"Yes it uses water droplets and vapor, labels and arrows.",People who want to know about condensation.,Show them my models and experiments with my evidence.301191,5,2,2,,2,,,0,0,0,0,0,My model might help explain condensation to someone who doesn't know much about it yet. Also so it can be compared to other models.,"The main way we were taught to make a good model is by using MSU. It is an acronym that stands for generality, audience, mechanism, and evidence. Following MSU will give you a good model.",,"Yes, you learned it, why not use it.",Learning condensation classes in the future.,"There are no holes in a container, so that can't happen."301193,5,2,2,,2,,,0,0,0,0,0,The purpose of my model is to show condensation on a window.,What makes my model a good model is that I show details and use arrows.,Yes it wouldn't be a very good model if you didn't.,Yes I put it in a paragraph.,MSU.,close all possible holes.301195,5,2,2,,2,,,0,0,0,0,0,Condensation.,Showing what used for.,No it would tack to long.,Yes it mack it easy to understand.,The people reading it.,Say that condensation is when water particles get formed all the outside.301202,5,2,2,,2,,,0,0,0,0,0,The purpose of my model is to show people what I mean or what I am saying. I would use for other people to see what happens about their beliefs so I could change my model.,A good model needs to show a pictures. It needs labels and a good explanation of what you mean. It would probably show a time line.,It should show all different ways. Then your model will be better and people will understand it.,Yes because I took those pieces of information that I learned in class and put that into my model.,I think my model is for people everywhere.,I might convince them by showing them that water can't seep into the water.301204,5,2,2,,2,,,0,0,0,0,0,The purpose of my model is condensation.,By making detail.,The situation you should focus on. Because it's smarter to think that way.,Yes it does because my model has different detail.,It's maybe for condensation.,It's has particles dripping out.301211,5,2,2,,2,,,0,0,0,0,0,The purpose of my model was that it had a humidifier to show that their was humidity in the air and low temp. to speed it up.,I think that particles makes a good model and also humidity makes a good model.,I think it should focus on one thing because you don't need to show all of the things at once.,Yes it uses humidity because we did experiments about humidity and a cold and hot coke can in humidity.,I think my model is for myself.,Well I would say that when water (liquid) gets cold it condenses onto something like windows or grass.301212,5,2,2,,2,,,0,0,0,0,2,The purpose of my model is to show what condensation works. I would use my model to help other people learn about condensation.,A good model shows how gas particles turn into water particles also it needs to be cold because if it's not cold the gas particles will not turn into water particles.,It should explain all the different ways. Because if someone who was never seen condensation they would be confused.,Yes it uses this information because I used what my classmates told me to add.,I think my model is for my teacher and class mates.,I would show the person my model then explain my ideas and then we could get a book to tell us.301215,5,2,2,,2,,,0,0,0,0,0,The purpose of my model is to show how a can condensates. My model is used for condensation.,"A good model is neat, original, and not confusing.",Mainly one thing. Because than it is easier to understand and it is faster.,It uses stuff that I learned in class. It uses it by showing how after a while the can condensates.,This model is for my teacher.,I can convince that person by showing them my model and how condensation happens.301224,5,2,2,,2,,,0,0,0,0,0,I could you my model for if I set a cold container out and I come back later and it has water droplets on it I would know it came from the air.,"Showing humidity, showing molecules, conservation of matter, showing particle nature.",Different ways because people in different situation will know what is happening.,Yes because when we did experiments I wrote down notes then added them to my model.,People who want to learn about condensation.,I could tell them that the air molecules slow down when they get cold and go onto the container.301225,5,2,2,,2,,,0,0,0,0,0,I would use my model by seeing the humidity and look at F at see what's the temp.,"What makes a good model is it has to show evidence, mechanism, audience, and generality.","I think it should all different ways that condensation happens. IT shows everything because it shows the generality, audience, mechanic, and evidence.","It shows the information from my class experiments, and my teacher and classmates ideas are. IT houses every thing because I showed the time, humidity, and the water particles.",My model is for dew on grass because it shows humidity and the water particles.,My model is for dew on grass because it shows humidity and every thing.301229,5,2,2,,2,,,0,0,0,0,0,To help me understand condensation.,Including the scientific ideas.,No because you want it to fit with generally in a game.,Yes it uses it by explain condensation.,The weather man.,I would tell them to hold a glass of water up and see if water seeps through.301176,5,2,3,,2,,,0,0,0,0,0,To show how to see the cups,"Light pathway, source, detector, object MSU",when light hits an object I bounces off into our eyes.,I think it should show different ways so you can get the idea and so people don't think it only works with a cup,little kids so they can learn about how they see.,Use a laser pointer to show when it hits something it goes in a straight line.301178,5,2,3,,2,,,0,0,0,0,0,I might use my model to explain light,Generality,,if you had a mirror then it would reflect letting you see behind you.,to explain light,301180,5,2,3,,2,,,0,0,0,0,0,"How we see, explain how and why","Not specific objects, light, etc. also scientific no doodles",The light goes into people eyes and at the object,"Yes, seeing so the model can fit into many different ideas",anyone it is made of any audience,Light travels straight not wavy like.301181,5,2,3,,2,,,0,3,0,0,0,"It was supposed to explain how to see the cup fro everyone's viewpoint, and behind you. I could explain that to someone whose confused.","It needs to have GAME, generality, audience, mechanism, and evidence.","I showed reflection, the pathway, and straight lines",All the different ways. A good model is general.,"Showing how to see a cup behind you, and in front of you. Because it is general!",Light can't go around objects; if it could there would be no shadows.301182,5,2,3,,2,,,0,0,0,0,0,To show how we saw the cup from behind us and in front of us. To show how you can see and how you can see thing behind you.,GAME does make a good model.,You can see the objects.,One thing because it will not work with more then one thing.,For people who want to now how you see thing. Because thats what the model is for.,Light travels in straight lines because it bounces off the cup and goes to our eyes at different angles.301189,5,2,3,,2,,,0,0,0,0,0,,,"it has reflectors, light sources, light detectors, objects and light pathway","I think it should included the different ways light helps us see because if it includes many was you won't get the idea, that I can't see back words or sideways because you don't just focused on one.",Our group and MSU science group. Both need the info.,Show them the model and explain it.301191,5,2,3,,2,,,0,0,0,0,0,To show that many people can see the same thing at a time.,Using MSU and using the 4 elements of seeing.,Because it uses everything a light model needs.,"I am not sure, do whatever you want with it. It probably could be used for many but I'm not one hundred per cent sure.",MSU. They made this program,"Light cannot do that, I would tell them to try it out in real life to see if it would work."301195,5,2,3,,2,,,0,0,0,0,0,Seeing thing around you,"arrows, MSU",it has all the things that we learned.,single situation because we weren't told to do anything except how we see the cup behind us.,Students so they can learn about light reflection.,tell them that light only travels in a straight pathway.301202,5,2,3,,2,,,0,0,0,0,0,The purpose was to understand when we can see the cup. I would use it for other models and use it.,,It fits because they follow the light principals.,Yes. Because then it tells more information to the person looking at the model.,My model should be for fourth graders because then they will get an idea of how light works and how we see light.,If the light travels in wavy lines then it doesn't really reflect off the object then it wouldn't really so much into our eyes.301204,5,2,3,,2,,,0,0,0,0,0,"So a person can see the cup from a mirror, light.",A model that has accomplishes a goal.,Like when I put descriptions.,You could use a mirror because a mirror can see behind you.,To do examples because it would help me understand.,Like have a light come to you first.301212,5,2,3,,2,,,0,0,0,0,3,The purpose of my model is to inform people on how you see different objects with the help of light. I would use my model to explain how lights helps us see.,"Using MSU which is generality, audience, mechanics, and evidence.",It fits the evidence I collected because I added everything that was needed to be a model.,I think it should explain all different ways that light helps us. Because there are more reasons for learning about light than just situations. ,Maybe just other students and the teacher. Because other students maybe need help with learning all about light and the teachers need to see what we did.,The light has to go in a straight line and go to the object then reflect off the object and goes to the people's eyes.301215,5,2,3,,2,,,0,0,0,0,0,The purpose is to show where you can see the cup I will use the model for nothing.,A good model explains and shows game with the needed things.,I started to show light pathways in my model to make it easier to understand.,On one site because it makes it easer to understand by showing less to talk about more ,The teachers because I have to give this test to them.,I might by telling them that light doesn't bend unless it's in water or in  black hole or other things.301219,5,2,3,,2,,,0,0,0,0,0,To tell some one about how we see.,MSU,It tot me you al that helped!!!,specific it would be ,youngsters,not at all does301224,5,2,3,,2,,,0,0,0,0,0,The purpose of my model is to show how all of our group members can see the cup. I could use my model for a research paper.,GAME makes a good model.,After learning the stuff I put it in my model.,It should explain different ways that light helps us see because there is less models to make.,"Teachers, friends, and researchers because it is going to be used by them.",I could tell them that light travels in straight lines but have multiple lines that can bounce off object in different directions.301225,5,2,3,,2,,,0,0,0,0,0,The purpose of model is to see the cup in the middle and behind.,Game activate mechanism evaluate,"Because it show game and it is neat, and it has arrows and it has details.",I think it just for specific situations like how to see a cup. Because it only show how you can see the cup.,Some one who needs help seeing a cup. Because they might need help look at a cup.,"Like this you can just see the cup in front of you, you don't even need light to see it."301229,5,2,3,,2,,,0,0,0,0,0,So I can learn and be successful in life.,"All details you need, game","it has a light source ,light detector, light pathway, and a object",How you can see the cup behind you well you don't need that 1st thing when they ask a question about light one specific thing,"Me, my teacher",To help me learn301230,5,2,3,,2,,,0,0,0,0,0,The purpose is to explain how light travels and I would use it explain that.,"Generality, audience, mechanics, evidence",I made these change so it would fit GAME,No it need to fit GAME,People who want to learn about light so learn about light,How can you prove this301146,6,3,4,,,1,,0,0,0,0,0,To show that odor is in the air and moves everywhere by bouncing of other particles.,"A good model should have a key, it should also be very general so you can relate it to other phenomena.",Yes because it shows the way they're going and witch is witch. So it makes better since.,,For MSU. Because is is there assessment that they sent.,Yes because it shows the way they're going and witch is witch. So it makes better since.