ID,grade,teacher,time,T1,T2,T3,T4,S1,S2,S3,S4,S5,purpose,criteria,generality,evidence,audience1,audience2301178,6,3,5,,,2,,0,0,0,0,0,To show how odor particles get to your nose.,In my eyes a good model has: 1. whatever your talking about or trying to show. 2. Effort and neatness. 3. generality of an overall topic (last year we learned MSU shows a good model.),I think it should cover all of the different ways that odors or air molecules move. So that if someone wanted to see in general what odors and air particles mix or get to your nose they wouldn't have to look at million different models. ,,Anyone how wants to learn about odor's particles. Because it shows an information needed to explain the topic to anyone.,I think it should cover all of the different ways that odors or air molecules move. So that if someone wanted to see in general what odors and air particles mix or get to your nose they wouldn't have to look at million different models. 301180,6,3,5,,,2,,0,0,0,0,0,"My purpose of this model is to show how odors, move across the room to a detector. The why of how odors move across the room where the odor comes from, and what happens overtime.","GAME. G is for generality, you have to make it work for every situation. A is for aim, you have to stay on the topic. M is for mechanism, you have to the ""How and Why"". E is for evidence, you have to show how you found out what you did. ",I think it should show all the different ways substances move around because the idea you drew should be general so it can explain the idea in different situations.,,"People who don't understand ideas about odors, molecules, and movement. Because then they will partly understand how odors move and what happens to odors.",I think it should show all the different ways substances move around because the idea you drew should be general so it can explain the idea in different situations.301193,6,3,5,,,2,,0,0,0,0,0,To explain how and why something happens.,"It has to be general, fit one type of audience, show evidence, and have mechanisms to show how it works.",All the different ways. A good model is general.,,How and why do smells move across the room. Because that is the question hat it was supposed to answer.,All the different ways. A good model is general.301212,6,3,5,,,2,,0,0,0,0,5,To explain a phenomena that someone doesnt understand.,A model that is self explanatory. A model that has a title.,No I think my model should show all the different ways the substance move because then the model is always right.,,People trying to under stand how odors move.,No I think my model should show all the different ways the substance move because then the model is always right.301215,6,3,5,,,2,,0,0,0,0,0,The purpose of a model is to show how and why odor travels.,"A good model has odor, air, movement, and answer about all questions asked.",Yes it should explain all the different way substances move in air. Because the model should not be specific about what the odor is so you can put the model in different phenomena. ,,My model is mainly for anyone 6th grade and up. It is very general and easy to understand for 6th graders or above.,Yes it should explain all the different way substances move in air. Because the model should not be specific about what the odor is so you can put the model in different phenomena. 301125,6,4,5,,,,2,0,0,0,0,0,"To show how particles, or how something works in general.",Being very specific and showing lots of details. You also need a key to tell you what is which is which in a model.,"I think it should describe a specific situation. Because then you are just looking at one situation, and not multiple because if you have a lot then it might get confusing. ",,For people who want to know how an odor can be across the room. Because in my model it has molecules that are traveling from different parts of the room.,"I think it should describe a specific situation. Because then you are just looking at one situation, and not multiple because if you have a lot then it might get confusing. "301341,6,4,5,,,,2,0,0,0,0,0,"In general the purpose of a model is to show in a picture or diagram how something works, in a scientific way.",In general what makes a good model is something thats easy to understand yet detailed at the same time.,"I think that it should mainly focus on a specific situation because it would take way to long to explain ""all"" the different whys the substances move around the room like odors or air molecules.",,I think my model is for Ms. Richter. I think my model is for Ms. Richter because she is the one who is grading my packet.,"I think that it should mainly focus on a specific situation because it would take way to long to explain ""all"" the different whys the substances move around the room like odors or air molecules."301136,6,4,5,,,,2,0,0,0,0,0,To show how odors spread.,Its general and work with all odors.,Yes because its a general model to all times an odor would spread.,,To show what I know so others can see what I've learned.,Yes because its a general model to all times an odor would spread.301176,6,4,5,,,,2,0,0,0,0,0,,"Generalization, keys, arrows, labels, mechanism, evidence.",No because it won't fit all phenomena.,,A person who is starting to learn odors. It is pretty basic and general.,No because it won't fit all phenomena.301182,6,4,5,,,,2,0,0,0,0,0,"The purpose of a model is to inform anyone interested in the concept or phenomena. Also, models are used to gather and sum up what you understand, how you've improved in learning, and how to improve more.",A good model consists of a clear focused idea shown through symbols and arrows. A good model should have a key to explain those symbols and should be able to explain a key question and be applied to all situations of similarity to that phenomena.,"Yes, I think my model should explain all the ways. I think this because if it can only explain one phenomena it might give your audience the idea that the molecules only move and do that with this phenomena.",,I think my model is for anyone who wants to learn about traveling odors. I think this because my model is used to inform and so anybody who wants to learn about this can be informed.,"Yes, I think my model should explain all the ways. I think this because if it can only explain one phenomena it might give your audience the idea that the molecules only move and do that with this phenomena."301195,6,4,5,,,,2,0,0,0,0,0,To show something that people usually can't see. ,"Generalization, and a clear picture.",Yes. People like to know about this kind of stuff.,,People who want to know about smell molecules. Because they want to learn.,Yes. People like to know about this kind of stuff.301224,6,4,5,,,,2,0,0,0,0,0,To show something.,A key and the model.,No it would be more boring than it is.,,MSU are teacher told us.,No it would be more boring than it is.301230,6,4,5,,,,2,0,0,0,0,0,To show the directions of what your talking about.,A model that what you talking about like a model that has directions.,I think they should stick with perfume because its easier.,,So the odors can have energy. Because if you dont have energy the odors dont do everything.,I think they should stick with perfume because its easier.301170,6,4,5,,,,2,0,0,0,0,0,To show your idea on a paper.,Key and sentences.,Yes because odors are all the same because the odor hit each other.,,Everyone because it is made for others.,Yes because odors are all the same because the odor hit each other.301123,6,4,5,,,,2,0,0,0,0,0,I think the purpose of a model is to teach/show/explain something or its just a way to put your ideas down and make them organized.,"Well, it needs to be true (obviously). It also has to be able to make sense to the audience so they can understand it. IT also has to fully answer the question, plus it needs to not be too specific so it can explain different phenomena.","It shouldn't focus on a specific situation. Then someone might think that example (what the model is showing) is different for different phenomena, and that it doesn't apply to other phenomena, which is wrong. ",,Next year's 6th graders. In the start of the year I didn't understand the question. I didn't know the answer and I had no idea what is was (the question equals how and why do odors travel across a room?),"It shouldn't focus on a specific situation. Then someone might think that example (what the model is showing) is different for different phenomena, and that it doesn't apply to other phenomena, which is wrong. "301134,6,4,5,,,,2,0,0,4,0,0,To show how something works. ,"A key, a neat model, and lots of detail.",Yes so people younger understand.,,Kids who don't know. So they can learn early so they don't have trouble.,Yes so people younger understand.301139,6,4,5,,,,2,0,0,0,0,0,To show what they do.,A key.,Yes because there all the same.,,All molecules because they all move the same.,Yes because there all the same.301181,6,4,5,,,,2,0,5,0,0,0,I would show them my model and tell them that other molecules bump into odor molecules to make them move around.,,I think my model should focus on specifically how the odor travels. model should be specific because it is not about how other substance move around.,,I think my model is for my teacher and I.,I think my model should focus on specifically how the odor travels. model should be specific because it is not about how other substance move around.301191,6,4,5,,,,2,0,0,0,0,0,To explain something with a picture.,"A key, neatness, and a question it answers or a title.","It will explain how all odors move. Because all odors move, and travel like air which is what I showed.",,Anyone because anyone who wants to know how odors move can see my model and learn.,"It will explain how all odors move. Because all odors move, and travel like air which is what I showed."301168,6,4,5,,,,2,0,0,0,0,0,To explain things we can't see and imagine how they look.,Key to explain what everything is. Arrows to show if anything is moving or hot. Labels to show what is that.,My model can be used for anything except for maybe when molecules are cooled because when you cool the molecules all the molecules would be joined together and kind of vibrate.,,Teachers or schools in elementary because they can learn about how molecules move.,My model can be used for anything except for maybe when molecules are cooled because when you cool the molecules all the molecules would be joined together and kind of vibrate.301202,6,4,5,,,,2,0,0,0,0,0,To help explain and tech us.,"A key, neatness, and words.",It should mainly focus the odor and air in the room. Cause your not taking about like oxygen.,,"MSU, and teacher, and me to help me learn.",It should mainly focus the odor and air in the room. Cause your not taking about like oxygen.301204,6,4,5,,,,2,0,0,0,0,0,The purpose of a model is to show or learn or teach to other people. You can also learn from models.,"What makes a good model? A good model is one with a key, what you are putting in your model has to do with what you learned in class.",Yes you should tell how the odors move. Because in the model you need to tell how the odor travels.,,To learn from and help me understand. Because it helps me understand better when we do more and more.,I could show them a model to help them understand better. The person would have to think about how the odor travels.301229,6,4,5,,,,2,0,0,0,0,0,The purpose of a model is to explain or understand how things work.,A good model explains things correctly and accurately.,I think my model should not explain for all different ways substances move. Because then their model will be complex.,,For people who don't know how odors get to their nose. Because the people can make detectors.,If a person is not in a straight line from the object. Then he shouldn't be able to smell it but he does. Person behind a wall can still smell the odor. The odor doesn't move in a straight line.301118,6,3,6,,,3,,0,0,0,0,0,For if someone needed to know.,Sentences that are true facts.,It should just address like how the grand canyon was formed. Because it doesn't explain all the other things.,It fits the explanation I said.,It is to help people see how water shapes landforms. Because it does.,I would tell them it.301146,6,3,6,,,3,,0,0,0,0,0,I might want to tell someone that is interested in how some canyons are made in valleys.,To  talk about what is the topic to know what is and complete and good explanation.,It should teach on one thing. It is easier to explain and that you can put one thing in more detail.,It shows how water takes dirt and rock breaks them apart and puts them somewhere else.,For people who need to know this information. They might want to know how water shapes our world.,Think of the ocean and that the earth is 75% water and how powerful and fast it is and how strong it is.301364,6,3,6,,,3,,0,0,0,0,0,The purpose of my explanation is to teach how a canyon river is formed. I might use my explanation for teaching kids who want to know how a canyon is formed.,I think correct information and explaining easily make a good explanation.,"Mainly on the Grand Canyon. My explanation explains how a canyon was formed, not different landforms.","The stream table had some land, but after a while there was a canyon because the water eroded and eroded the sand and kept on taking the sand until that path was fully eroded. There were two cliffs left which formed a canyon.","I think my information is for people who want to know the Grand Canyon as formed. My explanation show how a canyon is formed, so somebody who wants to know how the Grand Canyon is formed can use it too.","I can say that the whole ocean is the biggest reservoir of all and that the landforms are made of small stones, so when water goes over it, it collects the little stones and deposits them somewhere else."301211,6,3,6,,,3,,0,0,0,0,0,I might use this explanation for my teacher to evaluate me to see how much I know about canyons or someone who isn't sure about how the canyons were formed.,"Most of the time, you have to add details according to the picture and a key showing what you are actually talking about and try not to get off topic.","Yes and no. It usually depends. If you say that the canyons were formed by elves, no. But you can explain to that person by weathering and erosion, that is the cause or nature.",My revised explanation fits the evidence I collected because I thought about the erosion or weathering through out the unit.,People who don't know how it was formed. So I can explain through their knowledge and explain that nature sometimes carves rocks and other things from water or wind.,"I can explain to them that if water was really fast, it could out slowly the base of it if it can break it apart piece by piece."301131,6,3,6,,,3,,0,0,0,0,0,I think my explanation is correct because a little river can't erode the top of a plateau/cliff/area. You can also use this explanation to show how even small amounts of water weather a lot of a long period of time.,"This is a good explanation because it is more general. It doesn't say ""Rain erodes only canyons."" You could use this explanation for a few different phenomena.",Should address all ways. The explanation should address different ways because water weathers/erodes/deposits more than just rock from the Grand Canyon. Water erodes more than just landforms.,"My explanation fits this evidence because of an experiment we did in class. We sprayed the top of a plateau (made of paper). The water piled, but some damage was done by water still being sprayed.","Anyone learning about this topic. People of the general public would have need to know about the water erodes things. However, if you were learning, or it's for your job, you may need to know.","One thing you could get them to think of, is something bigger. Something like a typhoon or a hurricane. Both of those a water and they destroy more than you can possibly imagine."301189,6,3,6,,,3,,0,0,0,0,0,"The purpose is to explain how this happens, so that you an understand the process. I/you could use this explanation to tell someone who doesn't get it, how it works. ","Details, to know what your stating, to generalize, accuracy. ","It should be generalized to fit all ways. So this way you don't have to: look at numerous different models, get confused, mistake one for the other.",In the stream table experiment I saw (so did others) that the water eroded and deposited sand. Thats in my explanation.,All people who want/need it. Because anyone can learn.,Show them my model and tell them my reasoning.301132,6,3,6,,,3,,0,0,0,0,0,"The purpose of my explanation is to explain other scenarios similar to the Grand Canyon. For example, everyday rivers that are in my area.",A good explanation is one where the ideas are stated clearly and thoroughly everyone can understand. It gives reasons for things happen and backs it up evidence.,"Anyone who wants to know how water shapes land. Because it really can explain the answer to the question to anyone, but anyone who wants to know can know.","All situations. Because if I only show a specific situation, some might think that other canyons are shaped differently.",I would show them evidence and examples of water shaping landforms and give them the scientific explanation of why.,301169,6,3,6,,,3,,0,0,0,0,0,It can explain that water and erosion is very powerful and can do damage to landforms. This explanation could be to teach someone about how landforms are formed by water.,The things that make this a good explanation are that it describes things people might never have known.,My explanation can be used for different ways water shapes landforms. Because it again shows how water moves through landforms and breaks things like rock.,It shows and explains everything gone over in class like how water forms land.,This explanation could be for anyone who wanted to know how water and erosion shapes. Because it could help them study or how certain land forms formed. ,You could tell them or show them how water has a big effect on the things that happen to build today. Especially how the Grand Canyon was formed.301148,6,3,6,,,3,,0,0,0,0,0,The purpose of my explanation is to see how and why landforms are formed. I could use my explanation to teach other and I could add to it from other peoples ideas.,"A good explanation is when the person that is saying something is saying what he or she is thinking and the ""How and Why"". So if the person tells exactly what they think then its good.",I think it should show all the way water shapes things.,"My explanation shows that I learned that erosion, deposition, weathering is done by Earth and I evidence from landforms and models.",I think it is for other people. Other people can learn from my explanation and I can learn from other people's explanations.,I would tell them that a lot of water can break down things it just takes time to break it down.301149,6,3,6,,,3,,0,0,0,0,0,The purpose of my explanation is to tell how water shapes our world. I might use my explanation to show ways of how some landforms were made.,"What makes a good explanation is when you take a scientific topic, give good details, and clearly state the main ideas about why the topic happened.",I think my explanation should state all the different water shapes landforms. Because when I was in fifth grade I learned that you have to be general with your explanations.,MY explanation fits the evidence we collected during this unit because it talks about the different ways that water shapes the world.,I think this explanation is for Mr. Lee (I think that is his name). So Mr. Lee can study how we think.,"If they said water was to small to shape land forms I might show them my explanation and show them that water can frost wedge, weather erode, and deposit things and show them how a stream table works."301178,6,3,6,,,3,,0,0,0,0,0,To explain how river canyons are formed. I would use my explanation to teach people who don't know how river canyons are formed.,What makes a good explanation is when it is very descriptive and good detail.,It should focus on all the different ways. Because then you understand all of the situations and they won't be confusing. ,It fits the evidence because it describes how river canyons are formed in good details.,People who don't know how the water shapes landforms. Because then my explanation can help them understand it a little better.,"I would convince that person by telling them about the grand canyon and tell them of erosion, deposition, or weathering."301120,6,3,6,,,3,,4,0,0,0,0,To help people study landforms.,"Talking about actual fact, not theory.",A specific situation. So you can relate the specific situation to more situations.,It talks about things like erosion and that it is caused by water.,6th graders. It's a very basic explanation.,I might help them conduct an experiment that will prove them wrong.301180,6,3,6,,,3,,0,0,0,0,0,I may use it for showing the step by step process of how erosion works.,Describing every step in detail.,It should be about all places and not just one place. Because if someone wants to know more about if it works in other examples it would work.,It fits it by showing every step of water erosion in detail from the different experiments I did.,"Anyone wondering how erosion works. Because, if someone is drawing chart of progress then they could use this info.",It doesn't happen fast but as time goes on it takes bits of sand and dirt from the rock into water.301157,6,3,6,,,3,,0,0,0,0,0,The purpose of my explanation is to show how river canyons are formed. It shows how a river canyons is formed.,A good explanation shows how and why. A good explanation answer the question and is easy to understand.,It should apply to everything. The Grand Canyon is not the only landform shaped by water and people might think it only applies to the Grand Canyon.,"I learned that moving water created canyons, from the stream table experiments, so I put that in my explanation.","Anyone who was asked the question. If you're interested, but if you're not, you don't really absorb the information.","I think I could show them a stream table because thats what's going on, only on a smaller scale. But its not really the size of water, it's just the fact that it happens over and over again."301212,6,3,6,,,3,,0,0,0,0,6,"By giving them the correct answer, I hope.",,"People who don't understand. No one who does will read this, besides MSU to understand.",All different ways. Because science is general.,"If water is small, then why is our Earth mostly water?",301215,6,3,6,,,3,,0,0,0,0,0,The purpose is to show erosion. I might use it for telling people how canyons are formed.,A good explanation was to be detailed and factual. An explanation also has to be easy to understand while still proving the point.,"It should address all ways because it needs to be in depth. It should because an explanation needs to be in depth, and showing all possible ways something can happen.","My revised explanation fits because all he talked about in this unit is how water eroded our land and why, we also talked about how water could have formed canyon rivers.","This explanation is for everybody. It is for everybody because everything deserves to learn everything about the world, and how information. ","I might convince that person with my explanation, showing how if there is a lot of water in an area, it can shape landforms because of the massive amount of H20."301130,6,3,6,,,3,,0,0,0,0,0,You might use your explanation to explain how the water cut through the land and how the Grand Canyon formed.,A good explanation is describing what you need to describe in a way that makes since and give the reader enough information.,I think it should focus on how water shapes our landforms. Because if we learned how that forms we would know how the Grand Canyon formed.,It fits the evidence because in this unit we learned how water can cut through the land and make a canyon.,Someone who wants to know more about how the canyons are formed. Because that would be its purpose.,Over millions of years the water cuts into the land taking more and more away from the land making.301167,6,3,6,,,3,,0,0,0,0,0,"The purpose of my explanation is to explain other scenarios similar to the river canyon. For example, every day rivers that are in my area.",A good explanation is one where the ideas are stated clearly and thoroughly so that everyone can understand. It gives reasons things happens and backs it up evidence.,"All situations. Because if I only show a specific situation, some might think that other canyons are shaped differently.","In our unit we had stream tables and diagrams that showed how our land had been shaped over time. We read about examples of the breaking, moving, and depositing of earth materials and that helped me with my explanation of how and why water shapes land.","Anyone who wants to know how water shapes land. Because it really can explain the answer to the question to anyone, but anyone who wants to know can know.",I would show them evidence and examples of water shaping landforms and give them the scientific explanation of why.